{
  "articles": [
    {
      "category": "opensource",
      "collectedAt": "2026-10-28T12:15:08+08:00",
      "dateEvidence": "unknown",
      "id": "article-b1a02d251e036b08f89fdfb5",
      "publishedAt": null,
      "sourceId": "github-trending",
      "title": "elayadesign/ai-design-skills",
      "url": "https://github.com/elayadesign/ai-design-skills"
    },
    {
      "category": "opensource",
      "collectedAt": "2026-10-28T12:15:08+08:00",
      "dateEvidence": "unknown",
      "id": "article-078c0d35bad1b3fd8e9b87b3",
      "publishedAt": null,
      "sourceId": "github-trending",
      "title": "Nutlope/hallmark",
      "url": "https://github.com/Nutlope/hallmark"
    },
    {
      "category": "opensource",
      "collectedAt": "2026-10-28T12:15:08+08:00",
      "dateEvidence": "unknown",
      "id": "article-e4f6cd0ece3c7a0467ba1818",
      "publishedAt": null,
      "sourceId": "github-trending",
      "title": "nightly-labs/openbot",
      "url": "https://github.com/nightly-labs/openbot"
    },
    {
      "category": "opensource",
      "collectedAt": "2026-10-28T12:15:08+08:00",
      "dateEvidence": "unknown",
      "id": "article-77cbe1d03f2d725c73b7b494",
      "publishedAt": null,
      "sourceId": "github-trending",
      "title": "obra/superpowers",
      "url": "https://github.com/obra/superpowers"
    },
    {
      "category": "opensource",
      "collectedAt": "2026-10-28T12:15:08+08:00",
      "dateEvidence": "unknown",
      "id": "article-71d636020b7b25612e3e1d8d",
      "publishedAt": null,
      "sourceId": "github-trending",
      "title": "pbakaus/impeccable",
      "url": "https://github.com/pbakaus/impeccable"
    },
    {
      "category": "opensource",
      "collectedAt": "2026-10-28T12:15:08+08:00",
      "dateEvidence": "unknown",
      "id": "article-d3b0abc2e4d3291ea1628e7f",
      "publishedAt": null,
      "sourceId": "github-trending",
      "title": "makecindy/cindy",
      "url": "https://github.com/makecindy/cindy"
    },
    {
      "category": "opensource",
      "collectedAt": "2026-10-28T12:15:08+08:00",
      "dateEvidence": "unknown",
      "id": "article-304915c78c608df54f2998f1",
      "publishedAt": null,
      "sourceId": "github-trending",
      "title": "gitroomhq/postiz-app",
      "url": "https://github.com/gitroomhq/postiz-app"
    },
    {
      "category": "opensource",
      "collectedAt": "2026-10-28T12:15:08+08:00",
      "dateEvidence": "unknown",
      "id": "article-1ee7f958927399e5287f56c5",
      "publishedAt": null,
      "sourceId": "github-trending",
      "title": "affaan-m/ECC",
      "url": "https://github.com/affaan-m/ECC"
    },
    {
      "category": "opensource",
      "collectedAt": "2026-10-28T12:15:08+08:00",
      "dateEvidence": "unknown",
      "id": "article-d353c7ecbef6a5fe4a87cafa",
      "publishedAt": null,
      "sourceId": "github-trending",
      "title": "HKUDS/DeepTutor",
      "url": "https://github.com/HKUDS/DeepTutor"
    },
    {
      "category": "opensource",
      "collectedAt": "2026-10-28T12:15:08+08:00",
      "dateEvidence": "unknown",
      "id": "article-ad016608c6567ea33c421975",
      "publishedAt": null,
      "sourceId": "github-trending",
      "title": "JetBrains/thinkrail",
      "url": "https://github.com/JetBrains/thinkrail"
    },
    {
      "category": "opensource",
      "collectedAt": "2026-10-28T12:15:08+08:00",
      "dateEvidence": "unknown",
      "id": "article-a5c76f356ae354486bc3b72a",
      "publishedAt": null,
      "sourceId": "github-trending",
      "title": "togg53192-cmd/jailbreaks",
      "url": "https://github.com/togg53192-cmd/jailbreaks"
    },
    {
      "category": "opensource",
      "collectedAt": "2026-10-28T12:15:08+08:00",
      "dateEvidence": "unknown",
      "id": "article-6de510b74f76682d10dc30fa",
      "publishedAt": null,
      "sourceId": "weekly-high-stars",
      "title": "JustAResearcher/gpu-unlock-ada",
      "url": "https://github.com/JustAResearcher/gpu-unlock-ada"
    },
    {
      "category": "opensource",
      "collectedAt": "2026-10-28T12:15:08+08:00",
      "dateEvidence": "unknown",
      "id": "article-82680ee3b10874b364fe910f",
      "publishedAt": null,
      "sourceId": "weekly-high-stars",
      "title": "rddmwmddr/android-ad-cleaner",
      "url": "https://github.com/rddmwmddr/android-ad-cleaner"
    },
    {
      "category": "opensource",
      "collectedAt": "2026-10-28T12:15:08+08:00",
      "dateEvidence": "unknown",
      "id": "article-0e6f5a52703008f5634e523b",
      "publishedAt": null,
      "sourceId": "weekly-high-stars",
      "title": "designfuchen/word-atlas",
      "url": "https://github.com/designfuchen/word-atlas"
    },
    {
      "category": "opensource",
      "collectedAt": "2026-10-28T12:15:08+08:00",
      "dateEvidence": "unknown",
      "id": "article-bf084e4ba34275509a1c74fc",
      "publishedAt": null,
      "sourceId": "weekly-high-stars",
      "title": "unclebob/ub-mode",
      "url": "https://github.com/unclebob/ub-mode"
    },
    {
      "category": "opensource",
      "collectedAt": "2026-10-28T12:15:08+08:00",
      "dateEvidence": "unknown",
      "id": "article-e71a50dd4a49bed87d8b95d4",
      "publishedAt": null,
      "sourceId": "weekly-high-stars",
      "title": "t3dotgg/tstack",
      "url": "https://github.com/t3dotgg/tstack"
    },
    {
      "category": "opensource",
      "collectedAt": "2026-10-28T12:15:08+08:00",
      "dateEvidence": "unknown",
      "id": "article-ba1c4a80d4239cf9b91380e4",
      "publishedAt": null,
      "sourceId": "weekly-high-stars",
      "title": "oosexgang/hackios-xnu-kernel",
      "url": "https://github.com/oosexgang/hackios-xnu-kernel"
    },
    {
      "category": "opensource",
      "collectedAt": "2026-10-28T12:15:08+08:00",
      "dateEvidence": "unknown",
      "id": "article-a766259d37ea8397e4cc8fec",
      "publishedAt": null,
      "sourceId": "weekly-high-stars",
      "title": "DLSS-5-Swaper-New/.github",
      "url": "https://github.com/DLSS-5-Swaper-New/.github"
    },
    {
      "category": "opensource",
      "collectedAt": "2026-10-28T12:15:08+08:00",
      "dateEvidence": "unknown",
      "id": "article-e47c2736d7572f8a01e0adb3",
      "publishedAt": null,
      "sourceId": "weekly-high-stars",
      "title": "morganlinton/BeautifulRust",
      "url": "https://github.com/morganlinton/BeautifulRust"
    },
    {
      "category": "opensource",
      "collectedAt": "2026-10-28T12:15:08+08:00",
      "dateEvidence": "unknown",
      "id": "article-50d0ffbe4fc726731eacc795",
      "publishedAt": null,
      "sourceId": "weekly-high-stars",
      "title": "enesozturk/dimensional-drawing",
      "url": "https://github.com/enesozturk/dimensional-drawing"
    },
    {
      "category": "opensource",
      "collectedAt": "2026-10-28T12:15:08+08:00",
      "dateEvidence": "unknown",
      "id": "article-8d5733d637881583c5967dc6",
      "publishedAt": null,
      "sourceId": "weekly-high-stars",
      "title": "andyhuo520/digital-human-koubo",
      "url": "https://github.com/andyhuo520/digital-human-koubo"
    },
    {
      "category": "other",
      "collectedAt": "2026-10-28T12:15:08+08:00",
      "dateEvidence": "exact",
      "id": "article-ea6bf343eecfca2030d8a4a0",
      "publishedAt": "2026-10-27T19:55:06Z",
      "sourceId": "hacker-news",
      "title": "Survival LLM: AI assistant and emergency library that runs on your own computer",
      "url": "https://www.brangus.io/survival-llm"
    },
    {
      "category": "other",
      "collectedAt": "2026-10-28T12:15:08+08:00",
      "dateEvidence": "exact",
      "id": "article-bd4084e443243e18c8483c83",
      "publishedAt": "2026-10-27T20:50:42Z",
      "sourceId": "hacker-news",
      "title": "Early progress on accelerating drug development with Claude",
      "url": "https://www.anthropic.com/research/early-progress-drug-development"
    },
    {
      "category": "other",
      "collectedAt": "2026-10-28T12:15:08+08:00",
      "dateEvidence": "exact",
      "id": "article-a36babd14222c44f5285ba29",
      "publishedAt": "2026-10-27T22:23:37Z",
      "sourceId": "hacker-news",
      "title": "Expanding our partnership with GSA to bring Claude to all levels of government",
      "url": "https://www.anthropic.com/news/expanding-partnership-gsa"
    },
    {
      "category": "products",
      "collectedAt": "2026-10-28T12:15:08+08:00",
      "dateEvidence": "exact",
      "id": "article-fd8d816e7e9ff4414b08efc4",
      "publishedAt": "2026-10-26T13:06:22-07:00",
      "sourceId": "product-hunt",
      "title": "Nuvio 5.0",
      "url": "https://www.producthunt.com/products/nuvio"
    },
    {
      "category": "products",
      "collectedAt": "2026-10-28T12:15:08+08:00",
      "dateEvidence": "exact",
      "id": "article-7e4e5ae495428697aa28da3b",
      "publishedAt": "2026-10-22T07:16:30-07:00",
      "sourceId": "product-hunt",
      "title": "NuPlay",
      "url": "https://www.producthunt.com/products/nuplay"
    },
    {
      "category": "products",
      "collectedAt": "2026-10-28T12:15:08+08:00",
      "dateEvidence": "exact",
      "id": "article-04790296a7dcf4eb2d12c4d4",
      "publishedAt": "2026-10-26T14:29:10-07:00",
      "sourceId": "product-hunt",
      "title": "Revix AI",
      "url": "https://www.producthunt.com/products/revix-ai-2"
    },
    {
      "category": "products",
      "collectedAt": "2026-10-28T12:15:08+08:00",
      "dateEvidence": "exact",
      "id": "article-26a413d3a5148ef9f2914dff",
      "publishedAt": "2026-10-14T07:54:42-07:00",
      "sourceId": "product-hunt",
      "title": "Orbit",
      "url": "https://www.producthunt.com/products/orbit-app-blocker"
    },
    {
      "category": "products",
      "collectedAt": "2026-10-28T12:15:08+08:00",
      "dateEvidence": "exact",
      "id": "article-ecf3364278069f335eae9e27",
      "publishedAt": "2026-10-26T15:47:46-07:00",
      "sourceId": "product-hunt",
      "title": "PulseDev",